{
  "schemaVersion": 1,
  "registryId": "fixture/local-reuse-valid",
  "scope": {
    "kind": "local-file",
    "sourceFileName": "Fixture file",
    "sourceFileKey": null
  },
  "assets": [
    {
      "registryKey": "fixture/component/local",
      "semanticJob": "Representative locally verified component reuse contract",
      "kind": "COMPONENT",
      "identityState": "LOCAL_VERIFIED",
      "source": {
        "published": false,
        "fileName": "Fixture file",
        "fileKey": null,
        "nodeId": "1:10",
        "componentKey": null,
        "libraryName": null
      },
      "contract": {
        "anatomy": ["label", "value", "note"],
        "properties": ["contextual text overrides"],
        "states": []
      },
      "verification": {
        "state": "PASS",
        "observedAt": "2026-08-25T00:00:00.000Z",
        "evidence": ["fixture: four linked consumers resolve to source.nodeId"]
      },
      "consumers": [
        { "fileKey": null, "pageId": "1:1", "instanceId": "1:11", "mainComponentId": "1:10", "linkState": "LINKED" },
        { "fileKey": null, "pageId": "1:1", "instanceId": "1:12", "mainComponentId": "1:10", "linkState": "LINKED" },
        { "fileKey": null, "pageId": "1:1", "instanceId": "1:13", "mainComponentId": "1:10", "linkState": "LINKED" },
        { "fileKey": null, "pageId": "1:1", "instanceId": "1:14", "mainComponentId": "1:10", "linkState": "LINKED" }
      ]
    },
    {
      "registryKey": "fixture/component/published-library",
      "semanticJob": "Representative cross-file published component consumption boundary",
      "kind": "COMPONENT",
      "identityState": "NOT_RUN",
      "source": {
        "published": false,
        "fileName": "No authorized source file selected",
        "fileKey": null,
        "nodeId": null,
        "componentKey": null,
        "libraryName": null
      },
      "contract": {
        "anatomy": [],
        "properties": [],
        "states": []
      },
      "verification": {
        "state": "NOT_RUN",
        "observedAt": null,
        "evidence": []
      },
      "consumers": []
    }
  ]
}
