{
  "schemaVersion": 1,
  "registryId": "capability-demo-local-reuse-2026-08-19",
  "scope": {
    "kind": "local-file",
    "sourceFileName": "Untitled",
    "sourceFileKey": null
  },
  "assets": [
    {
      "registryKey": "capability/evidence-metric",
      "semanticJob": "Evidence metric with stable label, value, and comparison note anatomy",
      "kind": "COMPONENT",
      "identityState": "LOCAL_VERIFIED",
      "source": {
        "published": false,
        "fileName": "Untitled",
        "fileKey": null,
        "nodeId": "55:1138",
        "componentKey": null,
        "libraryName": null
      },
      "contract": {
        "anatomy": ["label", "value", "note"],
        "properties": ["contextual text overrides"],
        "states": []
      },
      "verification": {
        "state": "PASS",
        "observedAt": "2026-08-19T06:21:49.979Z",
        "evidence": ["output/figma-evidence/evidence.json#structuralEvidence", "4/4 listed consumers resolved mainComponentId 55:1138"]
      },
      "consumers": [
        { "fileKey": null, "pageId": "45:70", "instanceId": "55:1218", "mainComponentId": "55:1138", "linkState": "LINKED" },
        { "fileKey": null, "pageId": "45:70", "instanceId": "55:1222", "mainComponentId": "55:1138", "linkState": "LINKED" },
        { "fileKey": null, "pageId": "45:70", "instanceId": "55:1226", "mainComponentId": "55:1138", "linkState": "LINKED" },
        { "fileKey": null, "pageId": "45:70", "instanceId": "55:1230", "mainComponentId": "55:1138", "linkState": "LINKED" }
      ]
    },
    {
      "registryKey": "capability/published-library-proof",
      "semanticJob": "Representative cross-file published component consumption",
      "kind": "COMPONENT",
      "identityState": "NOT_RUN",
      "source": {
        "published": false,
        "fileName": "No authorized source file selected",
        "fileKey": null,
        "nodeId": null,
        "componentKey": null,
        "libraryName": null
      },
      "contract": {
        "anatomy": [],
        "properties": [],
        "states": []
      },
      "verification": {
        "state": "NOT_RUN",
        "observedAt": null,
        "evidence": []
      },
      "consumers": []
    }
  ]
}
